Codice Categoria/Nodo;Codice Categoria/Nodo Padre;Nome Categoria/Nodo Italiana;Nome Categoria/Nodo Inglese;Descrizione Categoria/Nodo Italiana;Descrizione Categoria/Nodo Inglese
19200;16860;SERVIZIO DA TAVOLO WELCOME ON BOARD;WELCOME ON BOARD TABLEWARE;SERVIZIO DA TAVOLA WELCOME ON BOARD;WELCOME ON BOARD TABLEWARE
19246;5957;BICCHIERI MAGNETICI SILWY;SILWY MAGNETIC GLASSES;BICCHIERI MAGNETICI SILWY;SILWY MAGNETIC DRINKWARE
19367;14636;KIT ANODI TECNOSEAL;TECNOSEAL ANODES KIT;;
19412;3418;HELLY HANSEN END SERIES;HELLY HANSEN END SERIES;;
19440;1611;SCARICHI E PRESE A MARE;DRAIN PLUGS AND INTAKE STRAINERS;;
19727;19725;VITI METRICHE DADI E RONDELLE IN BLISTER;SCREWS DICES AND WASHERS IN BLISTER PACKS;;
19726;19725;VITI PER LEGNO E AUTOFILETTANTI IN BLISTER;SCREWS IN BLISTER PACKS;;
19503;14448;PROLUNGHE E CAVI BANCHINA;SHORE EXTENSION AND OTHER CABLES;;
19584;3160;ACCESSORI PER ZATTERE DI SALVATAGGIO;LIFERAFTS ACCESSORIES;;
19618;3514;GRILLI IN ACCIAIO INOX;STAINLESS STEEL SHACKLES;;
19629;3514;MOSCHETTONI IN ACCIAIO INOX AISI 316;316 STAINLESS STEEL SNAP HOOKS;;
19657;3946;COPERTURE E TASCHE PER WINCH E MANOVELLE;WINCH AND HANDLES COVERS AND POCKETS;;
19664;2551;LUCI DI UTILITA' E CORTESIA IMPERMEABILI;WATERTIGHT UTILIY AND COURTESY LIGHTS;;
19677;2551;LUCI DI CORTESIA IMPERMEABILI STARLIGHT;STARLIGHT WATERTIGHT COURTESY LIGHTS;;
19699;18490;CARTUCCE FILTRI BENZINA;GASOLINE FILTER CARTRIDGES;;
19715;19713;DISPOSITIVI DI PROTEZIONE INDIVIDUALE ;PERSONAL PROTECTION EQUIPMENT;;
19755;3579;PULPITI E CANDELIERI;AMBOS AND STANCHIONS;;
19764;2469;FARETTI SUB E LUCI SOTTOPLANCIA;UNDERWATER SPOTLIGHTS AND UNDER PLATFORM LIGHTS;;
19833;16860;CUSCINI NAVISHELL;NAVISHELL CUSHIONS;;
19862;3159;BOE DA SEGNALAZIONE PER REGATA;REGATTA MARKING BUOYS;;
19863;19862;BOE DA REGATA;REGATTA BUOYS;;
